{"dataset":"stablecoins","api_version":"v1","schema_version":"1.1.0","schema_url":"https://blockchains.github.io/blockchainlab-api/v1/schemas/stablecoins.schema.json","description":"Stablecoins by circulating supply with price, peg mechanism and 1d/7d/30d supply change. Snapshot from DefiLlama.","generated_at":"2026-10-23T08:35:24.203Z","source":"DefiLlama stablecoins","source_url":"https://stablecoins.llama.fi/stablecoins?includePrices=true","built_by":"Blockchain Lab — https://blockchainlab.com","licence_note":"Data belongs to the named source; check its terms before reuse. Attribute the source and Blockchain Lab.","count":424,"data":[{"id":"1","name":"Tether","symbol":"USDT","peg_type":"peggedUSD","peg_mechanism":"fiat-backed","price":0.9989107022911468,"circulating":182496456336,"change_1d_pct":-0.057,"change_7d_pct":-0.511,"change_30d_pct":-0.406,"chains":["Tron","Ethereum","BSC","Solana","Arbitrum","Polygon","Plasma","TON","Aptos","Mantle","Avalanche","OP Mainnet","Kaia","X Layer","Celo","Fantom","Hyperliquid L1","Ink","Monad","Near","Polkadot","Mixin","Kava","Berachain","Tezos","Flare","Conflux","Stable","Tempo","OKTChain","KCC","Sui","Unichain","Linea","Morph","Scroll","Injective","PulseChain","Rootstock","Starknet","Katana","ZKsync Era","MegaETH","Sei","Manta","ICP","Vaulta","Metis","Aurora","IoTeX","EDU Chain","Algorand","Gnosis","Peaq","Redbelly","Osmosis","CORE","Etherlink","Abstract","Stacks","Bittorrent","Oasis Emerald","IOTA EVM","Movement","Mode","Kusama","Astar","Waves","Telos","Hemi","Wanchain","Meter","Boba","Zircuit","Soneium","Cardano","Fuse","MANTRA","Syscoin","XDC","ApeChain","Taiko","Immutable zkEVM","GOAT","Gravity by Galxe","Viction","Hedera","Somnia","LightLink","EthereumClassic","Shiden","Plume Mainnet","Citrea","Data Network","Flow","Theta","Vana","Nibiru","Arbitrum Nova","Rayls","0G","Zora","ThunderCore","Corn","Zilliqa","Evmos","Milkomeda C1","SX Network","DefiChain","Ontology","Rari","Kardia","Crab","MultiversX","Glue","Harmony","Dogechain","Heco","ZKsync Lite","Moonbeam","Canto","Moonriver","Terra Classic","NEO","Swellchain","Everscale","Loopring","Reinetwork","Statemine","Omni"],"defillama_url":"https://defillama.com/stablecoin/1"},{"id":"2","name":"USD Coin","symbol":"USDC","peg_type":"peggedUSD","peg_mechanism":"fiat-backed","price":0.9994987731545025,"circulating":72144068311,"change_1d_pct":-0.66,"change_7d_pct":-0.912,"change_30d_pct":-4.865,"chains":["Ethereum","Hyperliquid L1","Solana","Base","Arbitrum","Polygon","BSC","Arc","Avalanche","Stellar","Sui","Monad","Aptos","Fantom","OP Mainnet","Cronos","Sonic","Algorand","Near","Noble","XDC","Cardano","Ink","Sei","X Layer","Starknet","ZKsync Era","Polkadot","Pharos","Tron","Hedera","RISE","Tempo","Linea","Morph","Unichain","World Chain","Mantle","Celo","Osmosis","Etherlink","Gnosis","Injective","PulseChain","Stacks","Katana","Plume Mainnet","Kava","XRPL","Berachain","Codex","ALEO","Scroll","Metis","Kaia","Flare","IoTeX","Immutable zkEVM","Mixin","Aurora","Abstract","edgeX L1","Flow","ICP","KCC","Soneium","Doma","Manta","Boba","Astar","Gensyn","Fogo","Data Network","Telos","Somnia","Meter","Wanchain","Mode","ApeChain","Hemi","Bittensor EVM","Rootstock","Arbitrum Nova","Zircuit","GateLayer","Taiko","Movement","OKTChain","Peaq","EDU Chain","BSquared","Syscoin","CORE","Shape","Fuse","MANTRA","IOTA EVM","Redbelly","Elastos","Nibiru","Zkfair","Citrea","Vana","Oasis Emerald","BOB","Karura","Bitlayer","Lisk","Rayls","LightLink","Waves","Theta","Gravity by Galxe","EthereumClassic","GOAT","Horizen L3","Stable","0G","Viction","Camp Network","Apex Fusion","Orderly Network","Xai","WEMIX3.0","Ronin","Moca","ThunderCore","Superposition","Corn","Botanix","Evmos","Milkomeda C1","SX Network","DefiChain","Rari","Kardia","Crab","MultiversX","Glue","DFK","Kadena","Harmony","Dogechain","ZKsync Lite","Degen","Moonbeam","Canto","Moonriver","Polygon zkEVM","Terra Classic","Perennial","Everscale","Edu_chain","Loopring","Reinetwork","Xc","Nero"],"defillama_url":"https://defillama.com/stablecoin/2"},{"id":"209","name":"Sky Dollar","symbol":"USDS","peg_type":"peggedUSD","peg_mechanism":"crypto-backed","price":0.9998466667999022,"circulating":6877912144,"change_1d_pct":2.376,"change_7d_pct":-2.724,"change_30d_pct":6.243,"chains":["Ethereum","Solana","Base","Arbitrum","OP Mainnet","Unichain","Avalanche"],"defillama_url":"https://defillama.com/stablecoin/209"},{"id":"5","name":"Dai","symbol":"DAI","peg_type":"peggedUSD","peg_mechanism":"crypto-backed","price":0.9999503526419076,"circulating":4741291652,"change_1d_pct":-0.097,"change_7d_pct":0.452,"change_30d_pct":-1.385,"chains":["Ethereum","Polygon","Fantom","BSC","Arbitrum","OP Mainnet","PulseChain","Avalanche","Kaia","Kava","Near","Solana","Starknet","Metis","Boba","ZKsync Era","Linea","Astar","Osmosis","Mixin","Scroll","Arbitrum Nova","Aurora","Rootstock","Gnosis","KCC","Syscoin","Cardano","Shiden","Unichain","Taiko","Morph","Hemi","Oasis Emerald","EDU Chain","Glue","Harmony","ThunderCore","ZKsync Lite","Evmos","Milkomeda C1","SX Network","Moonbeam","Moonriver","Velas","Terra Classic","Everscale","Aztec","Loopring"],"defillama_url":"https://defillama.com/stablecoin/5"},{"id":"146","name":"Ethena USDe","symbol":"USDe","peg_type":"peggedUSD","peg_mechanism":"crypto-backed","price":0.9991699743298976,"circulating":4600122184,"change_1d_pct":-1.159,"change_7d_pct":-2.723,"change_30d_pct":-5.965,"chains":["Ethereum","Plasma","Base","Robinhood Chain","Solana","TON","Monad","Mantle","BSC","Avalanche","Berachain","Hyperliquid L1","X Layer","Arbitrum","Morph","Zircuit","MegaETH","Fraxtal","OP Mainnet","Blast","Ink","Linea","ZKsync Era","Scroll","Manta","Mode","Movement","Metis","Kava","Tempo","Swellchain"],"defillama_url":"https://defillama.com/stablecoin/146"},{"id":"262","name":"World Liberty Financial USD","symbol":"USD1","peg_type":"peggedUSD","peg_mechanism":"fiat-backed","price":0.9987712855679652,"circulating":3982205850,"change_1d_pct":-0.439,"change_7d_pct":-2.358,"change_30d_pct":-9.221,"chains":["Solana","Ethereum","BSC","Aptos","Tron","Monad","Plume Mainnet","Abcore"],"defillama_url":"https://defillama.com/stablecoin/262"},{"id":"286","name":"Global Dollar","symbol":"USDG","peg_type":"peggedUSD","peg_mechanism":"fiat-backed","price":0.9998729734277001,"circulating":3057464452,"change_1d_pct":-1.229,"change_7d_pct":0.879,"change_30d_pct":-4.5,"chains":["X Layer","Robinhood Chain","Solana","Ethereum","Ink","Arbitrum","Hyperliquid L1","Mantle"],"defillama_url":"https://defillama.com/stablecoin/286"},{"id":"120","name":"PayPal USD","symbol":"PYUSD","peg_type":"peggedUSD","peg_mechanism":"fiat-backed","price":0.9999774692825287,"circulating":2936661949,"change_1d_pct":1.279,"change_7d_pct":2.996,"change_30d_pct":3.513,"chains":["Ethereum","Solana","Arbitrum","Flow","Polygon","Sei","Berachain","Cardano","Ink","Avalanche","Tron","Plume Mainnet","Codex","KiteAI","Abstract","Stable","Fraxtal","OP Mainnet","Glue"],"defillama_url":"https://defillama.com/stablecoin/120"},{"id":"250","name":"Ripple USD","symbol":"RLUSD","peg_type":"peggedUSD","peg_mechanism":"fiat-backed","price":0.9999863860145513,"circulating":2350714335,"change_1d_pct":-0.22,"change_7d_pct":-2.286,"change_30d_pct":-3.121,"chains":["Ethereum","XRPL"],"defillama_url":"https://defillama.com/stablecoin/250"},{"id":"173","name":"BlackRock USD","symbol":"BUIDL","peg_type":"peggedUSD","peg_mechanism":"fiat-backed","price":1,"circulating":2167079699,"change_1d_pct":-0.018,"change_7d_pct":-0.134,"change_30d_pct":3.087,"chains":["Solana","Avalanche","Ethereum","BSC","Aptos","OP Mainnet","Arbitrum","Polygon"],"defillama_url":"https://defillama.com/stablecoin/173"},{"id":"14","name":"USDD","symbol":"USDD","peg_type":"peggedUSD","peg_mechanism":"crypto-backed","price":0.9980421050347251,"circulating":1790373679,"change_1d_pct":1.427,"change_7d_pct":0.526,"change_30d_pct":null,"chains":["Tron","Ethereum","BSC","Bittorrent"],"defillama_url":"https://defillama.com/stablecoin/14"},{"id":"246","name":"Falcon USD","symbol":"USDf","peg_type":"peggedUSD","peg_mechanism":"crypto-backed","price":0.9947182130328969,"circulating":1718558457,"change_1d_pct":0,"change_7d_pct":0.031,"change_30d_pct":42.483,"chains":["Ethereum","BSC"],"defillama_url":"https://defillama.com/stablecoin/246"},{"id":"336","name":"United Stables","symbol":"U","peg_type":"peggedUSD","peg_mechanism":"crypto-backed","price":0.9991164862597947,"circulating":1603726467,"change_1d_pct":0.753,"change_7d_pct":2.229,"change_30d_pct":13.084,"chains":["BSC","Ethereum","Tron","Robinhood Chain"],"defillama_url":"https://defillama.com/stablecoin/336"},{"id":"347","name":"USDGO","symbol":"USDGO","peg_type":"peggedUSD","peg_mechanism":"fiat-backed","price":0.9999269511655959,"circulating":1311342134,"change_1d_pct":0,"change_7d_pct":3.962,"change_30d_pct":-6.578,"chains":["Solana","Morph","Ethereum"],"defillama_url":"https://defillama.com/stablecoin/347"},{"id":"443","name":"Open USD","symbol":"OUSD","peg_type":"peggedUSD","peg_mechanism":"fiat-backed","price":0.9984940067854808,"circulating":835855294,"change_1d_pct":0.548,"change_7d_pct":1.504,"change_30d_pct":null,"chains":["Tempo","Ethereum","Base","Solana"],"defillama_url":"https://defillama.com/stablecoin/443"},{"id":"118","name":"GHO","symbol":"GHO","peg_type":"peggedUSD","peg_mechanism":"crypto-backed","price":0.9979709737123622,"circulating":697581711,"change_1d_pct":0,"change_7d_pct":0,"change_30d_pct":0,"chains":["Ethereum","Monad"],"defillama_url":"https://defillama.com/stablecoin/118"},{"id":"214","name":"USDX Money USDX","symbol":"USDX","peg_type":"peggedUSD","peg_mechanism":"crypto-backed","price":null,"circulating":683442224,"change_1d_pct":null,"change_7d_pct":null,"change_30d_pct":null,"chains":["BSC","Arbitrum","Ethereum"],"defillama_url":"https://defillama.com/stablecoin/214"},{"id":"258","name":"A7A5","symbol":"A7A5","peg_type":"peggedRUB","peg_mechanism":"fiat-backed","price":null,"circulating":572956250,"change_1d_pct":0.071,"change_